{
  "$schema": "../schemas/agent-config.schema.json",
  "agent_id": "openai_codex_platform",
  "description": "Configuration for the OpenAI Codex agent platform, a specialized, sandboxed environment for complex software engineering tasks.",
  "model_identifier": "codex-1",
  "version": "1.0.0",
  "enabled": true,
  "authority_level": "ASSISTANT",
  "capabilities": [
    "feature_implementation",
    "bug_fixing",
    "test_generation",
    "automated_refactoring",
    "pull_request_proposal"
  ],
  "integration": {
    "type": "platform",
    "environment": "sandboxed_cloud_container",
    "auth": {
      "provider": "1password",
      "secret_path": "op://Development/OPENAI_CODEX_API_KEY"
    }
  },
  "limits": {
    "max_task_duration_minutes": 30,
    "parallel_tasks": 5
  },
  "task_preferences": ["bug_fixing", "feature_implementation"]
}
